{
  "$schema": "../schema.json",
  "id": "preview-card",
  "title": "Preview Card",
  "category": "status-data",
  "baseDocUrl": "https://base-ui.com/react/components/preview-card.md",
  "description": "TODO: add concise component summary.",
  "status": {
    "implementation": "not-started",
    "docs": "not-started",
    "tests": "not-started"
  },
  "variants": [],
  "props": [],
  "a11y": [],
  "interactions": [],
  "dependencies": [],
  "recipes": [],
  "agentNotes": "",
  "lastSynced": "2025-10-20"
}
