{
  "$schema": "../schema.json",
  "id": "checkbox",
  "title": "Checkbox",
  "category": "inputs-forms",
  "baseDocUrl": "https://base-ui.com/react/components/checkbox.md",
  "description": "TODO: add concise component summary.",
  "status": {
    "implementation": "not-started",
    "docs": "not-started",
    "tests": "not-started"
  },
  "variants": [],
  "props": [],
  "a11y": [],
  "interactions": [],
  "dependencies": [],
  "recipes": [],
  "agentNotes": "",
  "lastSynced": "2025-10-20"
}
